{
  "scenario_id": "checkout-flow-busy-mom",
  "target_url": "https://shopee.tw/checkout",
  "target_goal": "Complete a purchase checkout flow as a busy mom with limited patience",
  "persona": {
    "name": "Busy Mom (Amy)",
    "age": 38,
    "tech_savviness": 2,
    "attention_span_seconds": 45,
    "motivation_level": 3,
    "cognitive_biases": ["loss aversion", "status quo bias"]
  },
  "max_steps": 5
}
